Sport,History,Images_url
SPORT CLIMBING,"What is Sport Climbing?
Sport Climbing is a modern discipline originated from traditional rock climbing. There are three different disciplines: boulder, lead and speed. In all of them, permanent anchors fixed to an artificial wall are used for climbing.

By whom, where and when was Sport Climbing invented?
It’s believed that climbing in natural rocks as a recreational activity started at the end of the 19th century. Climbing as a competitive sport started in 1985 in Bardonecchia near Turin, Italy in an event called “SportRoccia”. One year later, the first competition event on an artificial climbing wall was organised in Vaulx-en-Velin near Lyon, France.

In the early 1990s, it was decreed that international events would take place on purposely designed infrastructures only, leaving the natural environment without impact. One of the sport’s core values is the preservation of the environment, with climbers bearing responsibility for the upkeep of the settings in which they climb.",https://th.bing.com/th/id/OIP.bdqZhKmQFdDjp7vT32lKpAHaEK?pid=ImgDet&rs=1
SURFING,"What is Surfing?
Surfing is a water sport where an athlete performs manoeuvres on a wave while standing on a board.

By whom, where and when was Surfing invented?
Surfing is believed to have been practised by fishermen in ancient times in Peru and later, in around 400 AD, across Polynesia.

James King, who served under explorer Captain James Cook, wrote about surfing in Hawaii after Cook's death in 1779.
",https://coresites-cdn-adm.imgix.net/mpora_new/wp-content/uploads/2019/08/Surfing-At-The-Olympics.jpg?fit=crop
SWIMMING,"What is Swimming?
Swimming at the Olympics is both an individual and team sport where competitors propel their bodies through water in either an outdoor or indoor swimming pool using one of the following strokes: Freestyle, backstroke, breaststroke, or butterfly.

It is not to be confused with Marathon (open water) swimming, or artistic swimming at the Games, which are considered separate disciplines.

By whom, where and when was Swimming invented?
Prehistoric man learned to swim in order to cross rivers and lakes - we know this because cave paintings from the Stone Age depicting swimmers have been found in Egypt. Swimming was also referred to in Greek mythology.
",https://i.pinimg.com/originals/69/6f/06/696f06f1b64cd2f8a2358bedb7c690da.jpg
TABLE TENNIS,"What is Table Tennis?
Table tennis is a racket-and-ball sport played between two players or doubles teams, similar to tennis but on a table as its name suggests.

By whom, where and when was Table Tennis invented?
It is thought that upper-class Victorians in England invented table tennis in the 1880s as a genteel, after-dinner alternative to lawn tennis, using whatever they could find as equipment. A line of books would often be the net, the rounded top of a champagne cork would be the ball and occasionally a cigar box lid would be a racket.

In 1926, meetings were held in Berlin and London that led to the formation of the International Table Tennis Federation.
",https://th.bing.com/th/id/OIP.79ItF84kEoQWN_QzRqvKkgHaEK?pid=ImgDet&rs=1
TAEKWONDO,"What is Taekwondo?
Taekwondo is a traditional Korean martial art practised in 206 countries. that teaches more than physical fighting skills. Taekwondo is a Korean word composed of three parts - 'Tae' meaning foot or to step on, 'Kwon' means to fist or fight and 'Do' refers to the way or discipline.

In taekwondo, hands and feet can be used to overcome an opponent, but the trademark of the sport is its combination of kick movements.

By whom, where and when was Taekwondo invented?
The origin of taekwondo dates back to Korea's Three-Kingdom era (c.50 BC), when Shilla Dynasty warriors, the Hwarang, began to develop a martial art: Taekkyon (""foot-hand"").",https://th.bing.com/th/id/OIP.Xsd51kaXZdCwa6Y3JOACHQHaFG?pid=ImgDet&rs=1
TENNIS,"What is Tennis?
The modern game is played in singles (one player versus another), doubles (teams of two) and mixed doubles (mixed-gender teams) and features differing scoring systems across international events.

Tennis has a long history, but the birth of the game played today is thought to have taken place in England.

By whom, where and when was Tennis invented?
The earliest recognisable relative to tennis, as we know it, was ""jeu de paume"", played in 11th century France. Played in a monastery courtyard, the game used the walls and sloping roofs as part of the court and the palm of the hand to hit the ball.
",https://th.bing.com/th/id/OIP.em_L5UpeFuq_XR-ZnzMH3gHaQC?pid=ImgDet&rs=1
TRAMPOLINE,"What is Trampoline?
Trampoline is a breathtaking sport that can see athletes bounce over 8 metres in the air while performing a series of complex twists and somersaults. As it is a highly technical sport, trampolinists are required to have an exceptional sense of balance and absolute precision.

By whom, where and when was Trampoline invented?
The first modern trampoline was built by George Nissen and Larry Griswold around 1934 at the University of Iowa. It was initially used to train tumblers and astronauts, and as a training tool to develop and hone acrobatic skills for other sports such as diving, gymnastics and freestyle skiing. People enjoyed the sensation so much, they began to trampoline for sheer fun, and it became popular in its own right.

Nissen and Griswold envisaged trampolines being used in a variety of new games, although they never grabbed the public’s imagination. In one, called Spaceball, two teams of two on a single trampoline with specially constructed end walls attempted to propel a ball through a middle wall, to hit a target on the other side’s end wall.
",https://i.pinimg.com/originals/1e/0c/f6/1e0cf6347a05906470b3182cafef6a03.jpg
TRIATHLON,"What is Triathlon?
Triathlon is a multisport event that combines three disciplines: swimming, cycling and running. In triathlon, competitors compete in a race to the finish line with the first past the tape declared the winner.

By whom, where and when was Triathlon invented?

Triathlon was invented in the early 1970s by the San Diego Track Club in the USA as an alternative workout to the rigours of track training. The club's first event consisted of a 10km run, an 8km cycle and a 500m swim. Over the next decade, triathlon’s popularity continued to build, and it soon gained worldwide recognition.
",https://th.bing.com/th/id/OIP.Abf87Otf7ZrXn7SEC9vKWQHaEi?pid=ImgDet&rs=1
VOLLEYBALL,"What is Volleyball?
Volleyball is a sport played on a court by two teams of six players. The game was originally called “Mintonette”, a name derived from the game of badminton, because of its likeness to the sport.

By whom, where and when was Volleyball invented?
William G. Morgan, a YMCA physical education director and a student at Springfield College, is credited with creating the game of volleyball in 1895 in Holyoke, Massachusetts.

Mintonette (as volleyball was called at the time) was designed to be an indoor pastime that could be enjoyed by older members of the YMCA, and took some of its characteristics from other sports including tennis and handball.
",https://i.pinimg.com/originals/77/fb/9d/77fb9d48307a866db12c4a5824034339.jpg
WATER POLO,"What is Water Polo?
Water polo is a sport played in water between two teams of seven players, including one goalkeeper, all wearing matching coloured caps.

Players attempt to score goals by throwing the ball into the opposing team's goal, and the team with the most goals at the end of the game wins the match.

The sport is typically played in a 3m deep pool measuring 30,6m by 20m for men and 25,6m by 20m for women, so that players cannot touch the bottom.",https://olympic.ca/wp-content/uploads/2011/08/water-polo14.jpg?quality=100
WEIGHTLIFTING,"What is Weightlifting?
Weightlifting is a sport where athletes lift barbells loaded with weights. Weightlifting tests the strength, power and technique of athletes.

By whom, where and when was Weightlifting invented?
Weightlifting has ancient origins. It was practised both by ancient Egyptian and Greek societies. It developed as an international sport primarily in the 19th century, and is one of the few sports to have featured at the first modern Olympic Games in Athens in 1896.

At the beginning of the century, Austria, Germany and France were the most successful nations. However in the 1950s, the Soviet Union’s weightlifters rose to prominence and stayed there until the 1990s, when China, Turkey, Greece and Iran catapulted to the lead. In the women’s field, China has been dominant since the very beginning.
",https://th.bing.com/th/id/OIP.i5m1-m1T69d5-1kMBUAxmgAAAA?pid=ImgDet&w=189&h=267&c=7&dpr=1.3
WRESTLING,"What is Wrestling?
Wrestling is a sport where two individuals engage or grapple with the aim of throwing or holding their opponent’s shoulders to the ground, or else outscore them during the match.

At the Olympics there are two variations of wrestling: Freestyle and Greco-Roman. The rules are almost identical, except that in Greco-Roman a wrestler may not attack an opponent below the waist or use his own legs to execute holds.

With the possible exception of athletics, wrestling is recognised as the world’s oldest competitive sport.
",https://th.bing.com/th/id/R.96447801ffb814edaca824e3e551b967?rik=RMcf3OI0b43liw&riu=http%3a%2f%2fmediad.publicbroadcasting.net%2fp%2fkuow%2ffiles%2fstyles%2fmedium%2fpublic%2f201302%2fOlympic-wrestling.jpg&ehk=m0ryfXkFs9fTDCgGw8BxhM5leMcFdIs%2bl7jQ%2fQd7iyQ%3d&risl=&pid=ImgRaw&r=0
