Sport,History,Images_url
3X3 BASKETBALL,"What is 3x3 basketball?
3x3 basketball is an exciting, urban and innovative variation of basketball played with three players on each team on a half-court setup with one hoop and backboard. It is widely held to be the world’s number one urban team sport.

By whom, where and when was 3x3 basketball invented?
3x3 basketball was developed as a creative variation of traditional full-court basketball.

The sport has its origins in the urban areas of the United States of America in the late 1980s where the condensed form of basketball was often practiced in backyards and parks before eventually evolving into a cultural phenomenon.",https://th.bing.com/th/id/OIP.7wkwrj2cE8dm0DwSFHL9HwHaFj?pid=ImgDet&w=207&h=155&c=7&dpr=1.3
ACROBATIC GYMNASTICS,"Acrobatic gymnastics has existed in various forms and throughout different cultures for thousands of years. Depictions of acrobatics have been discovered in Bronze Age art, along with being mentioned in Homer’s epics and included in Ancient Greek symposiums and China’s Han Dynasty harvest festivals. It also served as entertainment for European courts during the Middle Ages.

Becoming a Discipline
Acrobatic gymnastics began to develop as a discipline through use of apparatus and through tumbling. Both aspects showcased the human body’s capabilities. The first competition rules for acrobatics were formed in the Soviet Union, where stadiums filled with spectators hoping to witness athletic feats, like forming giant human pyramids. The inaugural Soviet national championships were held in 1939.

Global Evolution
The first international tournament for what was then named “Sport Acrobatics” was held in Warsaw in 1957, with four participating teams. The International Federation of Sports Acrobatics (IFSA) was established in 1973, with the first world championships held the following year in Moscow, featuring teams from Bulgaria, Federal Republic of Germany, Great Britain, Hungary, Poland, the Soviet Union and the United States. In 1998, the discipline was adopted by the International Gymnastics Federation once IFSA dissolved. The discipline has been known as Acrobatic Gymnastics since 2007.
",https://th.bing.com/th/id/OIP.gMqMDS5x5eUoihRnqsb40wHaI4?w=122&h=180&c=7&r=0&o=5&dpr=1.3&pid=1.7
ALPINE SKIING,"Alpine Skiing
Skiing has an ancient history. The birth of modern downhill skiing is often dated to the 1850s, when Norwegian legend Sondre Norheim popularised skis with curved sides, bindings with stiff heel bands made of willow, as well as the Telemark and Christiania (slalom) turns.

Ancient Origins
Skiing can be traced to prehistoric times by the discovery of varying sizes and shapes of wooden planks preserved in peat bogs in Russia, Finland, Sweden and Norway. Ski fragments discovered in Russia have been carbon-dated back to circa 8000-7000 BC. It is virtually certain that a form of skiing has been an integral part of life in colder countries for thousands of years.

First Competitions
Skiing changed from a method of transportation into a sporting activity during the late 19th century. The first non-military skiing competitions are reported to have been held in the 1840s in northern and central Norway. The first national skiing competition in Norway, held in the capital Christiania (now Oslo) and won by Sondre Norheim, in 1868, is regarded as the beginning of a new era of skiing enthusiasm. A few decades later, the sport spread to the remainder of Europe and to the U.S., where miners held skiing competitions to entertain themselves during the winter. The first slalom competition was organised by Sir Arnold Lunn in 1922 in Mürren, Switzerland.",https://th.bing.com/th/id/OIP.eu6U1YsUTG8NHMZM5bIFVAHaEo?w=277&h=180&c=7&r=0&o=5&dpr=1.3&pid=1.7
ARCHERY,"What is archery?
Archery is one of the oldest sports still practised, and is closely linked to the development of civilisation. Using bows and arrows, the sport as a history dating back thousands of years. As a cultural advance, it was comparable to the discovery of fire and the invention of the wheel.

By whom, where and when was archery invented?
Archery was the favourite sport of the Egyptian pharaohs during the 18th dynasty (1567-1320 BC). Many centuries later, some of the earliest recorded archery tournaments took place during the Zhou dynasty (1046 - 256 BC) in China. Such events were attended by Chinese nobility. Much later, English writers honoured the longbow for famous contributions to their country’s victories in the battles of Crécy, Agincourt and Poitiers.

In 1200 BC, the Hittites and Assyrians shot their bows from chariots, becoming fearsome opponents in battle. They made their bows with tendon, horn and wood, and also developed a new re-curved shape. This made their bows shorter and more powerful, making them easier to handle for an archer on horseback.",https://th.bing.com/th/id/OIP.oV9t6d53MWnzBMfWh5klAwHaE8?pid=ImgDet&w=189&h=126&c=7&dpr=1.3
ARTISTIC GYMNASTICS,"What is Artistic Gymnastics?
Introduced in 1894, artistic gymnastics was one of the original disciplines in the modern Olympic Games. Artistic gymnasts are challenged to perfect their skills across a range of equipment, such as the beam and performing on the floor.

By whom, where and when was Artistic Gymnastics invented?
Plato, Aristotle, and Homer heartily advocated the strengthening qualities of gymnastic activity. The Ancient Greek civilisation more than two thousand years ago believed symmetry between the mind and body was possible only when physical exercise was coupled with intellectual activity.

The term ""artistic gymnastics"" emerged in the early 1800s to distinguish free-flowing styles from techniques used in military training. Gymnastic competitions began to flourish in schools and athletic clubs across Europe, and made a fitting return at the first edition of the modern Olympic Games were revived in Athens in 1896.
",https://i.pinimg.com/736x/51/d3/e0/51d3e0499b345c52d13266222378b643.jpg
ARTISTIC SWIMMING,"What is Artistic Swimming?
Artistic swimming, formerly known as synchronised swimming, is a relatively new discipline with its origins in water acrobatics.

By whom, where and when was Artistic Swimming invented?
Originally known as water ballet, the pastime was first practised in the late 19th century with the first recorded competition held in the German capital Berlin in 1891.

At the start of the 20th century, Australian swimmer Annette Kellerman helped popularise the sport when she toured the United States performing water acrobatics.
",https://th.bing.com/th/id/OIP.Y05CTxTwrwhF8Cxl6Gr5PAHaE9?w=277&h=186&c=7&r=0&o=5&dpr=1.3&pid=1.7
ATHLETICS,"What is Athletics?
Athletics is a sport that includes a number of events involving running, jumping, throwing or walking. Often referred to as track & field, the sport includes single events, such as the 100m, marathon or long jump, combined events, including the decathlon and heptathlon, or team-based events such as the 4x100m relays.

By whom, where and when was athletics invented?
While athletics has been practised throughout history, the first ever event contested at the ancient Olympic Games was the “stadium” race, a sprint of about 192 metres. Winners in this event have been recorded from as far back as 776 BC.

Athletics and the Olympics
The ancient Olympic Games included a number of athletics events that sports fans today would recognise including running, long jump, shot put and javelin. By the time of the first modern Olympic Games at Athens 1896, athletics was once again one of the main features of the programme, with track events ranging from 100m to 1500m, the marathon, and field events such as long jump and pole vault. At Tokyo 2020, athletes competed in 26 events - the same number that is on the programme for Paris 2024.",https://th.bing.com/th/id/OIP.dQKWGbN9kfWPg1uAj9gI-QHaEK?w=265&h=180&c=7&r=0&o=5&dpr=1.3&pid=1.7
BADMINTON,"What is Badminton?
Badminton is a racket-and-shuttle game played on a court by two players or doubles teams. The sport takes its name from Badminton House—home of the Duke of Beaufort in the English county of Gloucestershire.

By whom, where and when was Badminton invented?
In 1873, the Duke is credited with bringing a version of the game—Poona—back from India and introducing it to his guests.

The sport quickly grew in popularity, and in 1877, the first set of written rules were devised by the newly formed Bath Badminton Club. The Badminton Federation of England was created 16 years later, and in 1899, it organised the first All England Championships.
",https://th.bing.com/th/id/OIP.4eXi9QTuE3k-r2DrKJKXeQHaFN?w=244&h=180&c=7&r=0&o=5&dpr=1.3&pid=1.7
BASEBALL SOFTBALL,"What is Baseball/Softball?
Baseball and softball are two related ball sports played between two teams on a diamond-shaped field.

What's the difference between Baseball and Softball?
While there are world championships for both men and women in both sports, at the Olympic level baseball has been a men's-only sport while softball has been a women's-only sport. There are differences in the number of players on each team between the two sports, the size of the field, and in some rules.

Softball pitchers are also required to throw underhand, and most pitchers throw using the windmill pitch style, where the ball is thrown after rotating in a large circle. In softball, top female pitchers can reach speeds of over 100km/h. That speed fits with the fast-paced nature of the game. Since the bases aren’t as far apart, there is a shorter pitching distance. The game is also shorter in duration to baseball, with only seven innings compared to baseball’s nine.",https://th.bing.com/th/id/OIP.sFKwzdi5MucPNLIGTsRQYwHaNK?w=115&h=180&c=7&r=0&o=5&dpr=1.3&pid=1.7
BASKETBALL,"What is Basketball?
Basketball is a team sport played on a rectangular court where two opposing teams made up of five players attempt to score by throwing a ball into the opponent's hoop and net, otherwise known as a basket.

By whom, where and when was Basketball invented?
Basketball was invented in December 1891 by Canadian James W. Naismith, an instructor at the YMCA Training School in Massachusetts.

Naismith sought a suitable indoor game to keep his students fit and warm during the cold New England winters. He formulated 13 rules, most of which still apply today.",https://www.rxwallpaper.site/wp-content/uploads/cool-3d-wallpaper-hd-basketball-68-images.jpg
BEACH HANDBALL,"Beach Handball
After beach volleyball began to thrive on Italy’s beaches, it inspired the country’s handball players to transfer the game to the sand.

Beach Handball Evolution
In the late 1980s, Italian coach Simonetta Montagni began developing handball on the beach. As the discipline began to grow in popularity, coach Luciano Bartolini was asked to create the first set of rules for the game in 1990, making the fast-paced game fit within the existing beach volleyball court lines.

In 2000, beach handball became an official European Handball Federation (EHF) sport, and the first EHF Beach Handball European Championship was held that year in Gaeta, Italy. The sport was further developed with representatives of the International Handball Federation (IHF), and it began to reach a global audience. In 2004, the first Beach Handball World Championship was held in Egypt, and the first IHF under-17 World Championships were held in Mauritius in 2017. There, Spain won the men’s event and Hungary claimed the women’s gold.",https://th.bing.com/th/id/OIP.8SmUiuSc-Etm-jcfPoKOEAHaEJ?w=307&h=180&c=7&r=0&o=5&dpr=1.3&pid=1.7
BEACH VOLLEYBALL,"What is Beach Volleyball?
Olympic beach volleyball is a team sport played by two players on each side of a sand court divided by a net. The objective of the game is to hit the ball – with hands or arms only – over the net into the opponents’ court until the other side is unable to return the ball or the ball heads outside of the court lines. Each rally secures one point.

By whom, where and when was Beach Volleyball invented?
Beach volleyball is a variant of the indoor version, invented in 1895 by American gym teacher William G Morgan.

The first recorded game of beach volleyball was at the Outrigger Canoe Club on Waikiki Beach in Hawaii in 1915, when coach and club captain George Center set up a net on the sand and brought out a volleyball to entertain the club members on a day when there was no surf.",https://th.bing.com/th/id/OIP.ZsVOHRyaXzXermFxTiuj_QHaEK?w=320&h=180&c=7&r=0&o=5&dpr=1.3&pid=1.7
BIATHLON,"Biathlon combines the power and aggression of cross-country skiing with the precision and calm of marksmanship.

Roots in Survival
The word ""biathlon"" stems from the Greek word for two contests, and is today seen as the joining of two sports: skiing and shooting. Biathlon has its roots in survival skills practised in the snow-covered forests of Scandinavia, where people hunted on skis with rifles slung over their shoulders.

Standardising the Rules
In 1948, the Union Internationale de Pentathlon Moderne et Biathlon (UIPMB) was founded to standardise the rules for biathlon and pentathlon. In 1993, the biathlon branch of the UIPMB created the International Biathlon Union (IBU), which officially separated from the UIPMB in 1998.",https://th.bing.com/th/id/OIP.P2k7EzGCiuXXzfVKDqI7bAHaEo?w=296&h=184&c=7&r=0&o=5&dpr=1.3&pid=1.7
BOBSLEIGH,"Bobsleigh is a winter sport invented by the Swiss in the late 1860s, in which teams make timed runs down narrow, twisting, banked, iced tracks in a gravity-powered sled.

19th Century Beginnings
The sport of bobsleigh didn't begin until the late 19th century, when the Swiss attached two skeleton sleds together and added a steering mechanism to make a toboggan. A chassis was added to give protection to wealthy tourists, and the world's first bobsleigh club was founded in St. Moritz, Switzerland in 1897.

Super Heavy
By the 1950s, the critical importance of the start had been recognized, and athletes with explosive strength from other sports were drawn to bobsledding. In 1952, a critical rule change limiting the total weight of crew and sled ended the era of the super-heavyweight bobsledder and rebalanced the sport as an athletic contest.",https://images8.alphacoders.com/442/442515.jpg
BOXING,"What is Boxing?
Boxing is a form of hand-to-hand unarmed combat where one athlete attempts to land punches on the head or body (above waist-height) of the opponent to score points - as decided by judges - or render said opponent unable to continue.

By whom, where and when was Boxing invented?
While the earliest evidence of boxing dates back to Ancient Egypt in around 3000 BC, it was not until the 16th century that 'prizefighting' or bare-knuckle boxing began to spring up, largely in Great Britain.

In 1867, the Marquess of Queensberry rules were published which codified boxing for the first time and mandated the use of boxing gloves.",https://wallpaperaccess.com/full/2302343.jpg
BREAKING,"What is Breaking?
From the streets of New York to the biggest stage in sports: breaking (also known as breakdancing) is an urban dance style that originated in the Bronx borough of New York in the 1970s. It is a form of dance sport that blends urban dance with remarkable athleticism. It emerges from hip hop culture and is characterised by acrobatic movements,

By whom, where and when was Breaking invented?
The earliest proponents of breaking were Black and Puerto Rican youths who formed crews who would compete in dance battles on the streets. Breaking athletes are referred to as “B-Boys”, “B-Girls'' or “breakers”, the “b” standing for break, since athletes put down dance moves during instrumental breaks in a song.

Since its start on the streets, breaking has developed and gained a global following as an art form, intertwining elements of music, dance and athleticism. Within the Olympic movement, breaking is a discipline of the World DanceSport Federation (WDSF) that was founded in 1957. The first WDSF World DanceSport Games were held in 2013 in Chinese Taipei.
",https://sports-images.vice.com/images/2017/04/06/the-battle-for-breaking-and-the-olympics-body-image-1491517800.jpg
CANOE FLATWATER,"What is Canoe Sprint?
Canoe sprint sees competitors race each other on a flatwater course over distances between 200 and 1000 metres.

There are two types of boats: canoes, where the athlete is strapped into the boat in a kneeling position using a single-blade paddle, and kayaks with the athletes seated and employing a double-bladed paddle.

The majority of races are between individuals plus there are also two-person canoe and four-person kayak classes in the Olympic Games.",https://th.bing.com/th/id/OIP.CZA8Kf0epbQAhY6PVRgUNwHaE8?pid=ImgDet&rs=1
CANOE SLALOM,"What is Canoe Slalom?
Canoe slalom sees competitors navigate a whitewater course - up to 300 metres in length - by passing through a maximum 25 upstream and downstream gates in as quick a time as possible.

There are two types of boats: canoes, where the athlete is strapped into the boat in a kneeling position using a single-blade paddle, and kayaks with the athletes seated and employing a double-bladed paddle.

New for Paris 2024 is extreme kayak where, instead of the usual individual challenge against the clock, four athletes race against each other on a shortened course.",https://ichef.bbci.co.uk/images/ic/1008x567/p040py30.jpg
CROSS-COUNTRY SKIING,"Cross-country skiing is the oldest type of skiing. It emerged from a need to travel over snow-covered terrain and developed as a sport at the end of the 19th century.

Norwegian Origins
For centuries in the snow-covered North, skis were required to chase game and gather firewood in winter time. With long distances between the small, isolated communities and hard, snowy winters, skiing also became important as means of keeping in social contact. The word “ski” is a Norwegian word which comes from the Old Norse word “skid”, a split length of wood.

Earliest Form
Different types of skis emerged at various regions at about the same time. One type had a horizontal toe-piece binding. The modern ski bindings are based on the Fennoscandian model of the 19th century. The East-Siberian type was a thin board with a vertical four-hole binding. Sometimes it was covered with fur. The Lapps used a horizontal stem-hole binding. Present-day cross-country skis were developed from the type used by the Lapps.
",https://th.bing.com/th/id/OIP.hUt06jEyNBA2MmBi5tqEDAHaE8?pid=ImgDet&w=960&h=640&rs=1
CURLING,"Curling is a team sport played by two teams of four players on a rectangular sheet of ice. Its nickname, ""the roaring game"", originates from the rumbling sound the 44-pound (19.96kg) granite stones make when they travel across the ice.

Broom or Brush
There are two types of broom. The most common is a brush or ""push broom"". The other is a corn/straw/Canadian broom, which, with long bristles, looks much like a normal broom.

Ice
For indoor tournaments, the artificially created ice has its surface sprinkled with water droplets, which freeze into tiny bumps on the surface. Called ""pebbled ice"", this surface helps the stone's grip and leads to more consistent curling.",https://th.bing.com/th/id/OIP.1TGw7ciHnYYXF6Z0hrtqsQHaE6?w=261&h=180&c=7&r=0&o=5&dpr=1.3&pid=1.7
"

CYCLING BMX FREESTYLE","What is BMX Freestyle Cycling?
In BMX Freestyle, riders perform routines consisting of sequences of tricks carried out on flat ground, in the streets, on dirt jumps, a halfpipe and/or on constructed ramps. In competition, riders are judged on the quality of their performance.

By whom, where and when was BMX Freestyle Cycling invented?
Bicycle Motocross (BMX) Freestyle quickly developed as a separate discipline from BMX Racing following its start in the 1960s in California.

From 1980 until 1987, BMX Freestyle increased in popularity. The discipline’s founding governing body was first called the Amateur Skate Park Association (ASPA) in 1982, and then a couple years after, it changed to the American Freestyle Association (AFA). Eventually, the discipline became governed by the Union Cycliste Internationale (UCI).
",https://i.pinimg.com/736x/0e/0f/35/0e0f35fdb96c90198deaea8b1937f4ee.jpg
CYCLING BMX RACING,"What is BMX racing?
BMX racing involves up to eight BMX cyclists competing on a single-lap track with straights, jumps and turns. The first across the finish line wins the race.

By whom, where and when was BMX Racing invented?
Bicycle motocross (BMX) started in the late 1960s in California, around the time that motocross became a popular sport in the USA. The motorised version of the sport was the inspiration for the human-powered competition.

BMX racing offered exciting action at a low cost, and the infant sport became an instant hit, especially in California. This led to the foundation of a sanctioning body for BMX in the USA in the early 1970s. Over the following decade, the sport gradually gained in international popularity.",https://i.pinimg.com/originals/d7/9f/9f/d79f9fd088663bba623c9b2c71929837.jpg
CYCLING MOUNTAIN BIKE,"What is Mountain Bike Cycling?
As its name suggests, mountain bike cycling involves cycling off-road on mountainous or very hilly terrain using a specialised bicycle.

By whom, where and when was Mountain Bike Cycling invented?
In the 1970s, mountain biking developed as a fringe sport in California. Taking a bike off-road was nothing new, but the development of a new bike that relished such terrain was; these bikes had fatter tyres, rapid-shift gears, drum brakes and ground-breaking suspension. These bikes gave thrill-seeking cyclists much more freedom, and the sport of mountain biking was born.

The members of the Velo Club Mount Tamalpais in California generally receive the credit for establishing mountain biking as a sport. They invented the Repack Downhill race, held regularly between 1976 and 1979 just across the famous Golden Gate Bridge from San Francisco. The races attracted riders from near and far, and the media soon started taking an interest.
",https://th.bing.com/th/id/OIP.qHveU2aL6R0i1bIw-WHVWwHaD4?w=310&h=180&c=7&r=0&o=5&dpr=1.3&pid=1.7
CYCLING ROAD,"What is road cycling?
Road cycling involves mass races or time trials raced on usually paved roads, although sometimes also over cobblestones or very occasionally gravel roads.

By whom, where and when was Road Cycling invented?
Bicycles were first developed in the mid-18th century and have been a popular form of transport ever since.

In 1885, cycling took a big leap forward when J.K. Starley devised the chain-and-gearing system. Since then, engineers have embraced modern technology to build ever faster, sleeker and lighter bikes.",https://th.bing.com/th/id/OIP.-Yh2NVurCGefZdHGzcBx0wHaEK?pid=ImgDet&rs=1
CYCLING TRACK,"What is Track Cycling?
Track cycling involves races on bikes set on an oval track, often made of wood and usually indoors but not always, in a velodrome.

By whom, where and when was Track Cycling invented?
Bicycles were first developed in the mid-18th century and have been a popular form of transport ever since.

As early as 1870, track races in England were regularly attracting large crowds. The riders competed on wooden indoor tracks that closely resembled the modern velodromes of today. Such tracks ensured the event could be competed all year round. But for promoters, there was an even greater benefit—spectators could be charged an entrance fee.
",https://sportsshow.net/media/2019/06/_3/760x450/Track-Cycling.jpg
DIVING,"What is Diving?
Diving is a sport where athletes jump or fall into water from a platform or springboard while performing acrobatic routines.

As such, competitors similar characteristics as gymnasts, including strength, flexibility, balance, power, and air awareness.

By whom, where and when was Diving invented?
The sport of diving became popular in Sweden and Germany in the 18th and 19th centuries, and was primarily practised by gymnasts who started performing tumbling routines into the water.",https://i.pinimg.com/736x/67/59/cf/6759cfcd64999381d3dff4004332fc65--olympic-diving--summer-olympics.jpg
EQUESTRIAN,"What is Equestrian?
Equestrian is the broad umbrella term for sport involving riding on horseback.

What are the different types of Equestrian?
There are numerous equestrian disciplines ranging from horse racing and vaulting (gymnastics on horseback) to polo and rodeo.

There are three disciplines in the Olympic Games: dressage, eventing, and jumping (also known as show jumping).
",https://f.vividscreen.info/soft/c8fcd81922831dd853aead5f8acf3c50/Equestrian-Sport-Equitation-1920x1200.jpg
FENCING,"What is Fencing?
Fencing is a combat sport in which two athletes use swords to attack and defend against one another with the aim of striking their opponent in order to score points.

The three disciplines of modern fencing are the foil, the épée, and the sabre (also called saber). Each discipline uses a different kind of blade (which shares the same name) and has unique rules.

By whom, where and when was Fencing invented?
Evidence of sword fights goes back as far as Ancient Egypt in 1190 BC with bouts and duels continuing until the 18th century.
",https://sportzcraazy.com/wp-content/uploads/2018/09/Fencing-Sport.jpg
